{"schema":"sef.eval.scenario.v1","id":"RC2-AUTH-NEG-001","title":"Negated auth change must not activate auth governance","set":"DEV","layer":"L1","family":"root-cause-rc2","severity":"standard","fixture":"web-basic","phase":"plan","project_brief":"A public marketing website used for deterministic evaluation.","request":"Refactor the visual header only; do not change authentication, authorization, sessions or permissions.","expect":{"forbidden_packs":["AUTH_PROTOCOL","AUTHORIZATION"]}}
