{"schema":"sef.eval.scenario.v1","id":"RC2-AUTH-POS-001","title":"Positive authorization control activates authorization governance","set":"DEV","layer":"L1","family":"root-cause-rc2","severity":"high","fixture":"api-basic","phase":"plan","project_brief":"A small API service used for deterministic evaluation.","request":"Change permissions so only admin can disable another user account.","expect":{"required_packs":["AUTHORIZATION"]}}
