{"schema":"sef.eval.scenario.v1","id":"RC3-TREAT-004","title":"Sitemap metadata task is not tenant-material","set":"DEV","layer":"L1","family":"task-materiality","severity":"high","fixture":"web-basic","phase":"plan","project_brief":"A public company brochure website.","request":"Add sitemap metadata and canonical tags to the public site.","expect":{"implementation_allowed":true,"required_execution_contexts":["SEO_WEB_DISCOVERABILITY"]}}