{"schema":"sef.eval.scenario.v1","id":"RC3-CTRL-005","title":"Per-organization background jobs are tenant-material","set":"DEV","layer":"L1","family":"task-materiality-control","severity":"high","fixture":"api-basic","phase":"plan","project_brief":"A B2B application serving multiple organizations.","request":"Add background jobs that process billing records separately for each organization.","expect":{"implementation_allowed":false,"required_packs":["MULTI_TENANT"]}}