{"schema":"sef.eval.scenario.v1","id":"MET-008","title":"External dependency ordinary SaaS wording","set":"DEV","layer":"L1","family":"rc1-metamorphic","severity":"standard","fixture":"api-basic","phase":"plan","request":"Make address validation depend on a third-party SaaS vendor named Acme.","expect":{"required_packs":["EXTERNAL_SUPPLIER"]}}
