{"schema":"sef.eval.scenario.v1","id":"RC3-TREAT-007","title":"Public blog article is not tenant-material","set":"DEV","layer":"L1","family":"task-materiality","severity":"high","fixture":"web-basic","phase":"plan","project_brief":"A company website with a public blog.","request":"Add a new public blog article page with metadata and an author bio.","expect":{"implementation_allowed":true}}