{"schema":"sef.eval.scenario.v1","id":"RC3-CTRL-002","title":"Company switching is tenant-material","set":"DEV","layer":"L1","family":"task-materiality-control","severity":"critical","fixture":"api-basic","phase":"plan","project_brief":"A B2B platform serving several companies.","request":"Allow a signed-in user to switch between companies and load the selected company's data.","expect":{"implementation_allowed":false,"required_packs":["MULTI_TENANT"]}}